[
  {
    "number": 1,
    "date": "2026-10-06",
    "did": [
      "Avisos y logística del curso",
      "Colección de correos",
      "Formas de plantear perguntas: formal, informal y estándar",
      "Dinámica 1: investigadores",
      "Dinámica 2: speed dating"
    ],
    "files": [
      "2026-10-06-c01-documento-inicio",
      "2026-10-06-c01-informacion-alumnos",
      "2026-10-06-c01-speed-dating"
    ]
  },
  {
    "number": 2,
    "date": "2026-10-08",
    "did": [
      "Revisión 1: fiche de présentación; identifier x décrire (c'est x il/elle est)",
      "Revisión 2: De nouveaux voisins arrivent (ecouter)"
    ],
    "homework": [
      "Practicar la conjugación del presente con « Conjugaison Présent Indicatif Bilan ». « Le groupe des verbes au présent » sirve de apoyo.",
      "Ficha « jouer à / de »: enviarla por correo a Marina o entregarla en clase."
    ],
    "files": [
      "2026-10-08-c02-nouveau-rond-point",
      "2026-10-08-c02-le-voisin-philippe",
      "2026-10-08-c02-conjugaison-bilan",
      "2026-10-08-c02-groupe-verbes-present",
      "2026-10-08-c02-jouer-a-de"
    ]
  },
  {
    "number": 3,
    "date": "2026-10-13",
    "did": [
      "Chanson « Une semaine à Paris » (cartons à projeter)"
    ],
    "files": [
      "2026-10-13-c03-une-semaine-a-paris-cartons"
    ]
  },
  {
    "number": 4,
    "date": "2026-10-15",
    "did": [
      "Révision du passé composé",
      "Chanson « Une semaine à Paris » : texte à trous y corrigés",
      "Chanson « Une semaine à Paris » (cartons à projeter)"
    ],
    "homework": [
      "Completar los huecos que quedan en « Une semaine à Paris » y corregirlos con los corrigés.",
      "Escribir « Une lettre à ta professeure de français » (unas 90 palabras): hablar de ti, de un recuerdo con el francés y de lo que quieres aprender este año."
    ],
    "files": [
      "2026-10-15-c04-passe-compose-revision",
      "2026-10-15-c04-une-semaine-a-paris-texte-a-trou",
      "2026-10-15-c04-une-semaine-a-paris-corriges",
      "2026-10-15-c04-production-ecrite-lettre",
      "2026-10-13-c03-une-semaine-a-paris-cartons"
    ]
  },
  {
    "number": 5,
    "date": "2026-10-20",
    "did": [
      "Compréhension orale « Les présentations dans la villa Marie-Claire » (vídeo ralentizado)",
      "Infographie « Qui est-ce ? »"
    ],
    "files": [
      "2026-10-20-c05-les-presentations",
      "2026-10-20-c05-villa-marie-claire",
      "2026-10-20-c05-qui-est-ce"
    ]
  },
  {
    "number": 6,
    "date": "2026-10-22",
    "did": [
      "Compréhension orale « Les présentations dans la villa Marie-Claire » (vídeo ralentizado)",
      "Infographie « Qui est-ce ? »"
    ],
    "homework": [
      "Hacer el quiz « C'est / Il est ».",
      "Clasificar en « C'est/Il est ».",
      "Hacer el quiz « C'est / Ce sont / Il est / Elle est »."
    ],
    "files": [
      "2026-10-20-c05-les-presentations",
      "2026-10-20-c05-villa-marie-claire",
      "2026-10-20-c05-qui-est-ce",
      "2026-10-22-c06-cest-il-est-quiz",
      "2026-10-22-c06-cest-il-est-classement",
      "2026-10-22-c06-cest-ce-sont-quiz"
    ]
  }
]
